{
  "$schema": "http://json-schema.org/draft-07/schema#",
  "title": "ClaimSourceMapSchema",
  "description": "Contract generated by Drafting Agent mapping technical claims to Stable Source IDs and final IEEE citation numbers",
  "type": "object",
  "required": [
    "article_id",
    "generated_at",
    "source_to_ieee_map",
    "claims"
  ],
  "properties": {
    "$schema": {
      "type": "string"
    },
    "article_id": {
      "type": "string",
      "description": "Article identifier, e.g., BLOG_04"
    },
    "generated_at": {
      "type": "string",
      "format": "date-time"
    },
    "source_to_ieee_map": {
      "type": "object",
      "description": "Mapping from Stable Source ID (SRC-xxx) to IEEE reference number [n] based on first appearance order in the final article",
      "additionalProperties": {
        "type": "integer",
        "minimum": 1
      }
    },
    "claims": {
      "type": "array",
      "description": "Granular list of technical statements, quantitative thresholds, or formulas in the article",
      "items": {
        "type": "object",
        "required": [
          "claim_id",
          "claim_text",
          "source_ids",
          "evidence_ids",
          "citation_required",
          "locator_required",
          "verification_status",
          "locator_status"
        ],
        "properties": {
          "claim_id": {
            "type": "string",
            "description": "Claim identifier formatted as CLM-xxx",
            "pattern": "^CLM-[0-9]{3,}$"
          },
          "section_target": {
            "type": "string",
            "description": "Article section where the claim appears (e.g., Section 2.1)"
          },
          "claim_text": {
            "type": "string",
            "description": "The technical statement or quantitative threshold"
          },
          "source_ids": {
            "type": "array",
            "description": "Associated Stable Source IDs from evidence.json",
            "items": {
              "type": "string",
              "pattern": "^SRC-[0-9]{3,}$"
            },
            "minItems": 1
          },
          "evidence_ids": {
            "type": "array",
            "description": "Associated Evidence IDs from evidence.json backing this claim",
            "items": {
              "type": "string",
              "pattern": "^EVD-[0-9]{3,}$"
            },
            "minItems": 1,
            "uniqueItems": true
          },
          "citation_required": {
            "type": "boolean",
            "description": "Whether an in-text citation [n] at sentence end is required"
          },
          "locator_required": {
            "type": "boolean",
            "description": "Whether a specific locator (page/table/section) must accompany the citation"
          },
          "verification_status": {
            "type": "string",
            "enum": [
              "VERIFIED",
              "UNVERIFIED",
              "DISPUTED"
            ]
          },
          "locator_status": {
            "type": "string",
            "description": "Locator verification status; only LOCATOR_VERIFIED permits specific page/table/section locators",
            "enum": [
              "LOCATOR_VERIFIED",
              "LOCATOR_UNAVAILABLE",
              "LOCATOR_NOT_CHECKED",
              "LOCATOR_CONFLICT"
            ]
          },
          "assigned_ieee_numbers": {
            "type": "array",
            "description": "Final IEEE citation numbers corresponding to source_ids in first appearance order",
            "items": {
              "type": "integer",
              "minimum": 1
            }
          }
        },
        "additionalProperties": false
      },
      "minItems": 1
    }
  },
  "additionalProperties": false
}
