{
  "$schema": "../../02_AGENT_TEMPLATES/contracts/claim_source_map.schema.json",
  "article_id": "BLOG_04",
  "generated_at": "2026-09-25T16:36:00+07:00",
  "source_to_ieee_map": {
    "SRC-001": 1,
    "SRC-002": 2,
    "SRC-003": 3,
    "SRC-005": 4,
    "SRC-004": 5,
    "SRC-006": 6
  },
  "claims": [
    {
      "claim_id": "CLM-001",
      "section_target": "Section 2.1",
      "claim_text": "Biến tần (VFD) chuyển đổi năng lượng gián tiếp qua cấu trúc AC-DC-AC và điều khiển tốc độ từ trường quay stato thông qua việc thay đổi tần số ngõ ra trong dải 0-250 Hz.",
      "source_ids": [
        "SRC-001"
      ],
      "evidence_ids": [
        "EVD-001"
      ],
      "citation_required": true,
      "locator_required": true,
      "verification_status": "VERIFIED",
      "locator_status": "LOCATOR_VERIFIED",
      "assigned_ieee_numbers": [
        1
      ]
    },
    {
      "claim_id": "CLM-002",
      "section_target": "Section 2.2",
      "claim_text": "Khởi động mềm (Soft Starter) sử dụng các cặp thyristor (SCR) mắc phản song song trên từng pha để điều khiển góc kích pha, tăng dần điện áp hiệu dụng RMS trong khi tần số lưới giữ nguyên 50/60 Hz.",
      "source_ids": [
        "SRC-001"
      ],
      "evidence_ids": [
        "EVD-002"
      ],
      "citation_required": true,
      "locator_required": true,
      "verification_status": "VERIFIED",
      "locator_status": "LOCATOR_VERIFIED",
      "assigned_ieee_numbers": [
        1
      ]
    },
    {
      "claim_id": "CLM-003",
      "section_target": "Section 3.2",
      "claim_text": "Mô-men khởi động của động cơ không đồng bộ tỉ lệ với bình phương điện áp; theo Bảng 1 của Rockwell Automation, khi giới hạn dòng ở mức 150% dòng định mức (25% điện áp), mô-men khởi động sụt giảm xuống còn 6% mô-men định mức, và ở mức giới hạn dòng 300% (50% điện áp) mô-men đạt 25%.",
      "source_ids": [
        "SRC-002"
      ],
      "evidence_ids": [
        "EVD-003"
      ],
      "citation_required": true,
      "locator_required": true,
      "verification_status": "VERIFIED",
      "locator_status": "LOCATOR_VERIFIED",
      "assigned_ieee_numbers": [
        2
      ]
    },
    {
      "claim_id": "CLM-004",
      "section_target": "Section 3.3",
      "claim_text": "Biến tần có khả năng cung cấp đầy đủ 100% mô-men định mức ở tốc độ zero speed (0 rpm) cho các tải khởi động nặng, trong khi khởi động mềm không thể đáp ứng được khả năng sinh mô-men này tại tốc độ 0 rpm.",
      "source_ids": [
        "SRC-003"
      ],
      "evidence_ids": [
        "EVD-004"
      ],
      "citation_required": true,
      "locator_required": true,
      "verification_status": "VERIFIED",
      "locator_status": "LOCATOR_VERIFIED",
      "assigned_ieee_numbers": [
        3
      ]
    },
    {
      "claim_id": "CLM-005",
      "section_target": "Section 4",
      "claim_text": "Khởi động mềm chỉ kiểm soát điện áp trong quá trình tăng tốc và giảm tốc; sau khi kết thúc quá trình khởi động, động cơ vận hành cố định ở tần số nguồn lưới và thiết bị không có khả năng điều chỉnh tốc độ liên tục như biến tần.",
      "source_ids": [
        "SRC-001"
      ],
      "evidence_ids": [
        "EVD-005"
      ],
      "citation_required": true,
      "locator_required": true,
      "verification_status": "VERIFIED",
      "locator_status": "LOCATOR_VERIFIED",
      "assigned_ieee_numbers": [
        1
      ]
    },
    {
      "claim_id": "CLM-006",
      "section_target": "Section 5.1",
      "claim_text": "Khi động cơ vận hành ở tốc độ định mức đầy tải có tích hợp contactor bypass, khởi động mềm đạt hiệu suất vận hành cao hơn và chạy mát hơn biến tần do toàn bộ dòng tải chuyển qua tiếp điểm cơ khí thay vì linh kiện bán dẫn công suất.",
      "source_ids": [
        "SRC-003"
      ],
      "evidence_ids": [
        "EVD-006"
      ],
      "citation_required": true,
      "locator_required": true,
      "verification_status": "VERIFIED",
      "locator_status": "LOCATOR_VERIFIED",
      "assigned_ieee_numbers": [
        3
      ]
    },
    {
      "claim_id": "CLM-007",
      "section_target": "Section 5.2",
      "claim_text": "Contactor bypass tích hợp bên trong bộ khởi động mềm thông thường chỉ cần định mức tiêu chuẩn AC-1 (không yêu cầu AC-3) vì contactor bypass không bao giờ phải đóng hoặc cắt dòng điện trong quá trình vận hành bypass thông thường.",
      "source_ids": [
        "SRC-002"
      ],
      "evidence_ids": [
        "EVD-007"
      ],
      "citation_required": true,
      "locator_required": true,
      "verification_status": "VERIFIED",
      "locator_status": "LOCATOR_VERIFIED",
      "assigned_ieee_numbers": [
        2
      ]
    },
    {
      "claim_id": "CLM-008",
      "section_target": "Section 6.1",
      "claim_text": "Sóng hài dòng điện phát sinh từ khởi động mềm mang tính cục bộ ngắn hạn với độ méo THDi thường dưới 10% trong thời gian tăng tốc/giảm tốc khi SCR kích dẫn; ở chế độ vận hành bypass xác lập, thiết bị hầu như không phát sinh sóng hài lên lưới điện.",
      "source_ids": [
        "SRC-002"
      ],
      "evidence_ids": [
        "EVD-008"
      ],
      "citation_required": true,
      "locator_required": true,
      "verification_status": "VERIFIED",
      "locator_status": "LOCATOR_VERIFIED",
      "assigned_ieee_numbers": [
        2
      ]
    },
    {
      "claim_id": "CLM-009",
      "section_target": "Section 6.2",
      "claim_text": "Mức độ méo dòng sóng hài của biến tần phụ thuộc trực tiếp vào cấu trúc bộ chỉnh lưu và việc trang bị cuộn kháng AC/DC: cấu hình chỉnh lưu 6 xung có cuộn kháng điển hình có THDi khoảng 40%, cấu hình 12 xung giảm THDi về khoảng 10%, và biến tần sử dụng khối nguồn chủ động IGBT (Active Front End) có thể giảm THDi xuống khoảng 4%.",
      "source_ids": [
        "SRC-005"
      ],
      "evidence_ids": [
        "EVD-013"
      ],
      "citation_required": true,
      "locator_required": true,
      "verification_status": "VERIFIED",
      "locator_status": "LOCATOR_VERIFIED",
      "assigned_ieee_numbers": [
        4
      ]
    },
    {
      "claim_id": "CLM-010",
      "section_target": "Section 6.3",
      "claim_text": "Tiêu chuẩn IEEE Std 519-2022 không quy định ngưỡng phát xạ sóng hài cho từng thiết bị đơn lẻ mà quy định giới hạn méo dòng tổng TDD tại Điểm Đấu Nối Chung (PCC) của toàn bộ cơ sở phụ thuộc vào tỷ số ngắn mạch Isc/IL, trong đó giới hạn TDD là 5.0% đối với tỷ số Isc/IL < 20 ở cấp điện áp 120 V đến 69 kV.",
      "source_ids": [
        "SRC-005",
        "SRC-004"
      ],
      "evidence_ids": [
        "EVD-014",
        "EVD-009"
      ],
      "citation_required": true,
      "locator_required": true,
      "verification_status": "VERIFIED",
      "locator_status": "LOCATOR_VERIFIED",
      "assigned_ieee_numbers": [
        4,
        5
      ]
    },
    {
      "claim_id": "CLM-011",
      "section_target": "Section 6.3",
      "claim_text": "Tiêu chuẩn IEEE Std 519 không bắt buộc mọi biến tần phải lắp đặt bộ lọc sóng hài riêng lẻ; việc trang bị cuộn kháng, bộ lọc thụ động hoặc bộ lọc tích cực AHF là bài toán phân tích chất lượng điện ở cấp hệ thống phụ thuộc vào độ cứng của trạm biến áp và tổng phụ tải phi tuyến tại điểm PCC.",
      "source_ids": [
        "SRC-005"
      ],
      "evidence_ids": [
        "EVD-014"
      ],
      "citation_required": true,
      "locator_required": true,
      "verification_status": "VERIFIED",
      "locator_status": "LOCATOR_VERIFIED",
      "assigned_ieee_numbers": [
        4
      ]
    },
    {
      "claim_id": "CLM-012",
      "section_target": "Section 7.1",
      "claim_text": "Về mặt chi phí đầu tư ban đầu theo bối cảnh lịch sử công nghệ, ở dải công suất và dòng điện thấp thì chi phí giữa VFD và Soft Starter có mức tương đương hoặc chênh lệch không quá lớn, nhưng khi công suất và dòng điện tăng cao thì chi phí của VFD tăng cao hơn đáng kể so với Soft Starter.",
      "source_ids": [
        "SRC-002"
      ],
      "evidence_ids": [
        "EVD-010"
      ],
      "citation_required": true,
      "locator_required": true,
      "verification_status": "VERIFIED",
      "locator_status": "LOCATOR_VERIFIED",
      "assigned_ieee_numbers": [
        2
      ]
    },
    {
      "claim_id": "CLM-013",
      "section_target": "Section 7.1",
      "claim_text": "Theo bảng đối chiếu phương thức khởi động của ABB (2011), chỉ số chi phí lắp đặt bình quân ước tính theo trọng số tương đối (DOL = 1, Star-Delta = 3, Softstarter = 6, Drives > 12) phản ánh tương quan cấu trúc phần cứng của biến tần cao gấp đôi khởi động mềm, đóng vai trò tham chiếu so sánh định tính lịch sử chứ không phản ánh đơn giá thương mại cố định năm 2026.",
      "source_ids": [
        "SRC-001"
      ],
      "evidence_ids": [
        "EVD-016"
      ],
      "citation_required": true,
      "locator_required": true,
      "verification_status": "VERIFIED",
      "locator_status": "LOCATOR_VERIFIED",
      "assigned_ieee_numbers": [
        1
      ]
    },
    {
      "claim_id": "CLM-014",
      "section_target": "Section 7.2",
      "claim_text": "Khởi động mềm có thể tích vật lý và kích thước bao ngoài nhỏ hơn đáng kể so với biến tần trên toàn dải công suất; đối với các biến tần công suất lớn, kích thước thiết bị tăng mạnh và đòi hỏi bố trí không gian tủ điện kiểu MCC để chứa thêm các thiết bị phụ trợ đồng bộ như thiết bị cách ly, cuộn kháng và bộ hạn chế nhiễu EMC.",
      "source_ids": [
        "SRC-002"
      ],
      "evidence_ids": [
        "EVD-015"
      ],
      "citation_required": true,
      "locator_required": true,
      "verification_status": "VERIFIED",
      "locator_status": "LOCATOR_VERIFIED",
      "assigned_ieee_numbers": [
        2
      ]
    },
    {
      "claim_id": "CLM-015",
      "section_target": "Section 7.3",